{
  "runtimeVersion": 1,
  "app": {
    "id": "dev.actutum.security-fixture",
    "name": "Actutum Security Fixture",
    "version": "0.1.0"
  },
  "assets": {
    "root": "web",
    "entry": "index.html"
  },
  "window": {
    "width": 640,
    "height": 480
  },
  "security": {
    "permissions": ["app.info"]
  }
}
